{
  "phase": "P4_CLOSE",
  "objective": "Frozen P0/P2/P3 and affected P4 tests after wave-refinement blocker",
  "enabled": true,
  "depends_on": [
    "P2"
  ],
  "allowed_paths": [
    "dev_orchestrator/runs/"
  ],
  "forbidden_paths": [
    "motorsim/",
    "packaging/"
  ],
  "allowed_changes": [
    "Evidence only; source committed before run."
  ],
  "forbidden_changes": [
    "Toda modificaci\u00f3n de producto en esta versi\u00f3n."
  ],
  "commands": [
    {
      "id": "regression_tests",
      "kind": "test",
      "argv": [
        "{python}",
        "-c",
        "import unittest; patterns=['test_p2b*.py', 'test_gas1d.py', 'test_p2_fixes.py', 'test_p1_r2.py', 'test_p1_r3.py', 'test_p1_r4.py', 'test_p1_r4_gate.py', 'test_p1_r5*.py', 'test_coupling*.py', 'test_coupled.py', 'test_exhaust*.py']; suite=unittest.TestSuite(unittest.defaultTestLoader.discover(\"tests\",pattern=p) for p in patterns); result=unittest.TextTestRunner(verbosity=2).run(suite); raise SystemExit(not result.wasSuccessful())"
      ],
      "timeout": 180
    },
    {
      "id": "baseline_command",
      "kind": "command",
      "argv": [
        "{python}",
        "-m",
        "dev_orchestrator.p4_regression",
        "--run-dir",
        "{run_dir}"
      ],
      "timeout": 180,
      "result_file": "artifacts/result.json"
    }
  ],
  "required_tests": [
    "regression_tests"
  ],
  "required_checks": [
    "regression_tests",
    "historical",
    "P3_frozen",
    "P3_evidence",
    "P3B",
    "P3C",
    "baseline_command"
  ],
  "required_evidence": [
    "artifacts/regression.json",
    "artifacts/result.json"
  ],
  "gate": "default",
  "max_repair_attempts": 0,
  "review": "required",
  "human_gate": true,
  "scientific_changes_authorized": false,
  "timeout": 400
}
